,links,dates,titles,content
11,https://www.seniorsadvocatebc.ca/app/uploads/sites/4/2020/11/StayingApartToStaySafe-NR.pdf,"Nov 03, 2020","Staying Apart to Stay Safe: The Impact of Visit Restrictions on Long-Term Care and Assisted Living Survey (pdf, 192 KB)","NEWS RELEASE FOR IMMEDIATE RELEASE November 3, 2020 Visits to Long-Term Care Must Balance Health Risks with Quality of Life B.C. Seniors Advocate Releases Results of Province-wide Survey   Victoria, B.C. Today, British Columbia Seniors Advocate Isobel Mackenzie released the results of a province-wide survey on the impact of visit restrictions at long-term care and assisted living homes. The report, Staying Apart to Stay Safe, reflects the experience of more than 13,000 residents and their family members over the course of the current pandemic.    we face,long-term care and assisted living homes because we care about the seniors who live there, and we want to keep them safe. But as we enter our ninth month, British Columbia seniors and their families are seeking a better balance between preventing the transmission of COVID-19 and ensuring quality of   Calls, letters and emails on the issue of visit restrictions have dominated the Office of the Seniors Advocate more than any other single issue in its history. Many of the stories detail the negative impact of limited visits or no visits, with some residents and their family members expressing more fear about loneliness than contracting COVID-19.  The report highlights that when COVID-19 first struck care homes, the Province acted swiftly and decisively, bringing in a number of prevention measures that have seen B.C. perform relatively well in managing COVID-19 in long-term care and assisted living.   and comprehensive actions at the beginning of this  Mackenzie. any lives were undoubtedly saved. However, residents and family members now recognize the pandemic will continue for many more months, and the survey makes it clear they are asking for more time with their loved ones  , the goal was to ensure residents in long-term care and assisted living were kept safe from COVID-19. Eight months later, we need to ask the question: What are we keeping them safe for if it is not to enjoy the time they have left with the ones they love? While COVID-19 has tragically claimed the lives of 151 residents of long-term care and assisted living more than 4,500 other residents have died from something other than COVID-19 during this pandemic and in many cases, they spent their final months, weeks and days in relative isolation, unable to spend time with those they loved most,continued Mackenzie. The survey generated over 13,000 valid responses from all parts of the province. In a series of questions covering visits before the pandemic, during the first phase of visit restrictions, and currently, the survey found:  Before the pandemic, 55% of families were visiting long-term care and assisted living residents for an hour or more several times per week and even daily;  Prior to COVID-19, the majority of visitors were performing essential care for residents, such as personal care, grooming, assistance with feeding and mobilization;  Most family members were not aware of the possibility of essential visits during the first four months of visit restrictions, and almost half of the people who did apply for an essential visit were refused;  Under the current visitation policy, the majority of visits are only once a week or less, and half the visits in long-term care are 30 minutes or less;  30% of current visits are outside only;  Currently, 65% of visits are observed by staff for some or all of the time;  -term care residents and almost 100% of assisted living residents live in private rooms);  70% of visitors are not allowed to touch their loved one;  Most visitors are washing their hands, wearing a mask, having their temperature checked, and answering health questions prior to each visit; and  Most family members and residents support some visit restrictions during the pandemic, although they believe visits should be more frequent and that at least one more visitor for each resident should be permitted.  The report also highlights data that points to signs of negative health impacts on residents. Of concern to the Seniors Advocate is the substantial increase in the use of antipsychotic medication during the period of visit restrictions and clinical assessments completed in the first quarter that show an increase in unexplained weight loss and worsening of mood or symptoms of depression.  The report also highlights the need for residents and family members to have a collective voice in the decision-making process and makes three recommendations:   1. Allow all residents to designate an essential care partner; 2. Allow social visitors and determine the number allowed by balancing the risk of COVID-19 with the risk to a residents health from the long-term family separations; 3. Create a provincial association of long-term care and assisted living resident and family councils.  The complete report is available at https://www.seniorsadvocatebc.ca/reports/  Media Contact Vicki Swan| 236-478-3582 E. vswan@gov.bc.ca www.seniorsadvocatebc.ca Backgrounder:  On January 28, 2020, British Columbia identified its first case of COVID-19.   On March 7, 2020, a North Vancouver care home declared the first COVID-19 outbreak in a Canadian long-term care home. On March 9, this care home recorded the first death from COVID-19 in Canada.   On March 11, 2020 the World Health Organization declared COVID-19 to be a pandemic.  On March 17, 2020, the Provincial Health Officer (PHO) of British Columbia, Dr. Bonnie Henry, declared COVID-19 a public health emergency under the Public Health Act.   On March 20, 2020, the Province implemented a policy around essential visits to long-term care and assisted living homes. On May 19, 2020, an amendment was made to this policy to more clearly define essential visits.  On March 26 and 27, 2020, the PHO issued an order on Long-Term Facility Staff Movement Limitation under the Public Health Act.   On April 10, 2020, the PHO issued an order on Facility Staff Assignment under the Public Health Act.  On June 30, 2020, the Province announced new requirements that would allow for family and social visits at long-term care homes and assisted living facilities.  On August 26, 2020, the Office of the Seniors Advocate launched Staying Apart to Stay Safe: The Impact of Visit Restrictions on Long-Term Care and Assisted Living Survey. The survey closed on September 30, 2020.   Over 13,000 people participated in the survey:  9,870 responses (75%) were from visitors/family;  2,053 responses (16%) were from residents; and  1,219 responses (9%) were from interested members of the public who are neither visitors nor residents. Participants could complete the survey:  online at www.carehomevisits.ca;  through a telephone interview facilitated by a team of 49 volunteers; or  by completing a paper copy of the survey and returning it by mail. Of the 13,142 valid survey responses:  11,707 (89%) were collected from the online survey;  233 (2%) were collected over the phone; and  1,202 (9%) were collected via paper-based surveys. Responses were received from all parts of British Columbia. Organized by health authority the numbers were:  29% of visitor responses, and 34% of resident responses, were from Interior Health;  28% of visitor responses, and 20% of resident responses, were from Fraser Health;  16% of visitor responses, and 15% of resident responses, were from Vancouver Coastal Health;  22% of visitor responses, and 23% of resident responses, were from Island Health; and  4% of visitor responses, and 6% of resident responses, were from Northern Health."
12,https://www.seniorsadvocatebc.ca/app/uploads/sites/4/2020/10/Oct-1-International-Day-of-Older-Persons.pdf,"Oct 01, 2020","B.C.’s Seniors Advocate Statement on International Day of Older Persons 2020 (pdf, 119 KB)","STATEMENT FOR IMMEDIATE RELEASE October 1, 2020  B.C.™s Seniors Advocate Statement on International Day of Older Persons 2020 Victoria, B.C Œ ﬁFor the past 30 years, we have been celebrating October 1st as the United Nations International Day of Older Persons. However, this year is an October 1st like no other, for the world at large, and, in particular, older adults.ﬂ ﬁThroughout the past seven months of sacrifice, uncertainty and tragedy, we have learned many things about each other and older adults. One of the most heartening lessons learned has been that we care; we care about each other, and we particularly care about older adults in our lives. So, let's pause during this most extraordinary of times to celebrate the seniors in our lives. Let's celebrate the resiliency of older adults who have shouldered the higher burden of illness with this pandemic. Let's celebrate the collective desire of everyone to make the future better for older adults. Let us celebrate that many of us came to recognize just how much we love and cherish the seniors in our lives when we found them under threat, a legacy that will forever enrich us and the lives of those around us.ﬂ  Isobel Mackenzie Seniors Advocate"
13,https://www.seniorsadvocatebc.ca/app/uploads/sites/4/2020/08/LTC-AL-Survey-Visitor-Restrictions_NR-.pdf,"Aug 26, 2020","B.C Launches Survey to Assess the Impact of Visitor Restrictions in Long-Term Care and Assisted Living (pdf, 215 KB)","Media Contact Jim Beatty | 250-812-9286  jim@jbcomm.ca www.seniorsadvocatebc.ca                        NEWS RELEASE FOR IMMEDIATE RELEASE August 26, 2020 B.C. Launches Survey to Assess the Impact of Visitor Restrictions Victoria, B.C. B.C.today launching a province-wide survey that will allow residents of long-term care and assisted living and their family members to tell the story of their experience during this pandemic. Of the many hardships that COVID-19 has brought, one of the most heartbreaking has been the need to limit those who can visit residents of long-term care and assisted livingRestricting visitors to long-term care and assisted living facilities has been an enormous sacrifice for our seniors and their families, but it has been necessary for us to protect those who are most vulnerable to this virus. The impact however is having a profound effect on many people and it is time for these people to have their voices heard and their stories told  The survey, Staying Apart to Stay Safe: The Impact of Visitor Restrictions on Long Term Care and Assisted Living, is asking residents and family members about their experiences before the pandemic and how these have been impacted over the past seven months.  The survey, which can be completed until September 30, is available at www.carehomevisits.ca play an integral role in supporting the health and well-being of residents.  Family members are sometimes at the bedside providing care, they are helping their loved ones at mealtimes and they are keeping their loved one engaged in the world around them.  The loss of this connection has had an impact not just on residents, but family members themselves have clearly been impacted as well. We want to better understand how much life has changed for the family member and for the resident living in long term care and assisted living   .  We need to hear your voice as we plan for a future that will see us living with this pandemic well into the next year, The survey is online at carehomevisits.ca and respondents can choose from the following options: 1. The survey can be completed on-line at www.carehomevisits.ca 2. The survey can be downloaded and a print copy can be completed and mailed in. 3. Residents and/or family members can call the Office of the Seniors Advocate at 1-877-952-3181 and request that a copy be sent to them in the mail. 4. Residents and/or family members can call the Office of the Seniors Advocate and request to complete the survey over the phone.   A backgrounder follows. BACKGROUNDER Facts about long-term care and assisted living in B.C.   The visitor restrictions affect approximately 560 long-term care and assisted living homes with approximately 40,000 beds.   Visit restrictions began on March 20th   On June 30th, visit restrictions were expanded beyond essential visitors to allow for one designated visitor per resident.   Since March 7 (date Lynn Valley outbreak declared), 46 long-term care homes/assisted living sites have experienced an outbreak of COVID-19, with some having had more than one outbreak.   Since March 7, 355 residents and 233 staff have been infected with COVID-19.   Since March 7, 123 residents of long-term care and assisted living have died from COVID19.   In 2019/20, 103 long-term care homes in BC experienced 170 outbreaks of a communicable disease such as influenza or norovirus.   In an average year, over 7,000, or approximately 21% of residents in long term care pass away.   Media Contact: Jim Beatty | 250-812-9286  jim@jbcomm.ca www.seniorsadvocatebc.ca"
14,https://www.seniorsadvocatebc.ca/app/uploads/sites/4/2020/06/June-23-NR-Seniors-Advocate-Property-Tax-Deferral.pdf,"Jun 23, 2020","Seniors Advocate Property Tax Deferral (pdf, 142 KB)","1  NEWS RELEASE FOR IMMEDIATE RELEASE June 23, 2020 Seniors Advocate Reminds Seniors of the Option for Property Tax Deferral Victoria, B.C.Š B.C.™s Seniors Advocate Isobel Mackenzie is reminding seniors they can defer paying their property tax through the provincial Property Tax Deferment (PTD) Program.   ﬁWith the PTD program, the province pays the property tax on behalf of the senior directly to the local government. The senior homeowner does not need to pay back the money to the province until the property is sold,ﬂ said Mackenzie. ﬁThe PTD program has been gaining in popularity and had 63,581 deferrals in 2018/19 with an average of $4,064 in property tax deferred.ﬂ  New in 2020, is an online application and the ability to automatically renew each year. Previously, applications were paper based only and needed to be re-submitted each year. Seniors can now visit the Ministry of Finance website and complete the form online or download the form and mail it in. For individuals without the internet or those needing more assistance, they can call the Ministry of Finance at 1-888-355-2700, and an agent can help with the application process. Seniors can also visit their local Service BC office or municipal government office if there is one open in their area and receive a copy of the form.   Due to the COVID-19 pandemic, many municipalities have extended their property tax deadline and penalty rate and date, so homeowners are encouraged to contact their municipality to understand their tax deadline.   Learn More:  For information about the Property Tax Deferment Program and to apply online, visit: https://www2.gov.bc.ca/gov/content/taxes/property-taxes/annual-property-tax/defer-taxes For assistance with applying to the Property Tax Deferment Program, contact the Ministry of Finance: Toll-free 1-888-355-2700 Office: 250-387-0555 Email: TaxDeferment@gov.bc.ca  For information about the Office of the Seniors Advocate, visit: https://www.seniorsadvocatebc.ca/   Media Contact Celine Comeau | Communications Officer  Cell: 250-886-4307 2   BACKGROUNDER  B.C.™s Property Tax Deferment (PTD) program allows eligible homeowners 55 and older, surviving spouses and persons with disabilities to defer paying their property taxes.    The deferred taxes accrue and are paid back when the house is sold, or if the homeowner wishes, they can pay back all or a portion of the deferred amounts earlier.     Each year there is an average of $172 million taxes deferred and $70.6 million repaid.   The PTD program began in 1974, and as of September 30, 2019, the cumulative total amount of property tax deferred is $1.35 billion.    There are currently 63,581 homeowners deferring their property tax with the average homeowner using the PTD program accruing a cumulative total of $21,502 in deferred property taxes.    There are more than 10,000 new applicants for PTD each year. In the past five years, the number of new users has increased by 148%.   While the PTD program is growing each year, 2019/20 saw fewer new users for the first time: 11,879 new users in 2018/19 compared to 13,719 in 2017/18.   The median assessed value of the homes in B.C. for which property taxes were deferred in 2018/19 was $998,000, up 10% from the previous year.    The total amount of property tax deferred in 2018/19 was over $237 million, a 14% increase over the previous year. Of this amount, approximately $37 million were newly deferred.    The PTD deferral program charges simple interest only. Under the regular program, homeowners are charged simple interest at a rate not greater than 2% below the prime rate. Currently, the interest rate is 1.95%. Over the past five years, the interest rate has ranged from a low of .85% to 1.95%."
15,https://www.seniorsadvocatebc.ca/app/uploads/sites/4/2020/06/June-15-Statement-World-Elder-Abuse-Awareness-Day_.pdf,"Jun 15, 2020","B.C.’s Seniors Advocate Statement on World Elder Abuse Awareness Day 2020 (pdf, 144 KB)","1  STATEMENT FOR IMMEDIATE RELEASE June 15, 2020 B.C.™s Seniors Advocate Statement on World Elder Abuse Awareness Day 2020 Victoria, B.C.Š"" June 15th was designated World Elder Abuse Awareness Day (WEAAD) by the United Nations in 2011. Today is an opportunity to reflect and to educate ourselves, our seniors, organizations, and policymakers on the realities of elder abuse in our community.ﬂ  ﬁElder abuse takes many forms, whether it is psychological, financial, emotional, physical or sexual abuse. We all have a role to play in helping to eliminate elder abuse by educating ourselves on the signs and symptoms of elder abuse and reporting concerns to the appropriate people.ﬂ  ﬁIn addition to a current systemic review of elder abuse and neglect that is currently underway, my office, along with the BC Securities Commission produced an educational video about the signs of financial elder abuse, which includes the mishandling of an older person™s money or property and acts of fraud. This is very timely as the challenges of responding to the COVID-19 pandemic may place increased pressure on seniors to financially support family members or as seniors look to new investments during the current uncertainty in the markets.ﬂ   ﬁMy office has also worked with the Office of the Information and Privacy Commissioner to launch an awareness campaign to help seniors understand how to protect their privacy online and off, with tips about protecting your personal information. This is particularly important as more seniors turn to the internet during the pandemic for ordering goods and supplies and to communicate with friends and family.ﬂ ﬁAs the world collectively places their attention upon elder abuse, you will see symbols of supports across the province with purple lights illuminating the Legislature and the WEAAD flag flown in Victoria, people wearing purple clothing or dawning purple ribbons. Today, I encourage you to educate yourself about elder abuse and to know how to report it. Elder abuse is preventable, and everyone has a role to play.ﬂ View the financial elder abuse video https://vimeo.com/429153502 View the privacy brochure for seniors https://www.oipc.bc.ca/media/17317/privacy-tips-for-seniors-brochure_oipc_seniors-advocate.pdf Isobel Mackenzie Seniors Advocate   Media Contact Celine Comeau | Communications Officer Cell: 250 886-4307 www.seniorsadvocatebc.ca 2  BACKGROUNDER  Identifying Elder Abuse The abuser is often a spouse or partner, family member (often adult child), caregiver, friend, or a trusted person in the senior™s life. Financial abuse is often accompanied by other forms of abuse, such as emotional abuse, physical abuse, or denial of rights.  Specific signs of financial abuse may include:  the senior not having sufficient cash for their daily expenses  the senior not knowing the details of their financial position or being evasive about it when questioned  adult children living with the senior with no visible means of support  the senior having paid for goods and services which they do not need Reporting Financial Elder Abuse Elder Financial abuse can be reported to the following agencies.   RCMP/Local Police   BC Securities Commission  Telephone: 1-800-373-6393 (toll free) or 604-899-6854 Email: inquiries@bcsc.bc.ca Website: www.investright.org   Consumer Protection BC   Website: https://www.consumerprotectionbc.ca/consumer-help/ Telephone: 1 888-564-9963   Seniors First BC  Telephone: 1-866-437-1940 (toll-free) or 604-437-1940         Website: http://seniorsfirstbc.ca/ Seniors Abuse & Information Line (SAIL): TTY: 604-428-3359TTY Teletype for the deaf   Regional Health Authorities   Their role as designated agency is to respond to all types of seniors™ abuse. Website: https://www2.gov.bc.ca/gov/content/health/about-bc-s-health-care-system/partners/health-authorities/regional-health-authorities    Government of BC Œ Scams and Frauds Website: https://www2.gov.bc.ca/gov/content/family-social-supports/seniors/financial-legal-matters/scams-and-fraud"
16,https://www.seniorsadvocatebc.ca/app/uploads/sites/4/2020/06/Statement-Seniors-Advocate-BC-Seniors-Week.pdf,"Jun 01, 2020","B.C.’s Seniors Advocate Statement on Seniors’ Week (pdf, 167 KB)","Media Contact Celine Comeau | Communications Officer Cell: 250-886-4307 www.seniorsadvocatebc.ca      STATEMENT FOR IMMEDIATE RELEASE June 1, 2020  Seniors Advocate  Victoria, B.C.""Each year, the first week of June in traditionally a time when we celebrate the contributions of those one million British Columbians who are over the age of 65. The week is generally filled with events that gather seniors together, with government officials cutting cakes and presenting recognition awards. My office is usually engaged in activities throughout the province and I generally issue a statement that speaks to the diversity of seniors and to the extraordinary contribution they make to our community through prolific volunteering  -Week in B.C. However, I think there is a reason to celebrate as enthusiastically as in past years. Although these are uncertain times, I find hope in how the public has shown that, when the chips are down, when seniors are in need, we mobilize as a community, a province and a country, and we say loud and clear to You matter to us and we are here for you.  ensuring that our elderly family, friends and neighbours had the groceries and medications they needed.  When the province asked people to call 2-1-1 and volunteer to help seniors in their community, the phone lines momentarily crashed from the overwhelming response. Eight weeks later, we find ourselves with 10,000 volunteers throughout the province who have provided over 50,000 virtual visits and phone calls, almost 11,000 grocery deliveries and over 14,000 meal deliveries to seniors who are isolated at home.  In addition, everywhere we turn, companies and community fundraisers are stepping up to provide tablets to care homes, allow of frail seniors. Governments at the local, provincial, and federal levels have made loud and clear commitments to support  advocates are now happening around dinner tables from Corner Brook to Nanaimo. This level of engagement and commitment is what we need and as we launch  during a pandemic. Let us also celebrate this fact: we have shown that, as British Columbians, we clearly cherish and value the older adults in our lives, and we are committed to providing them with the best possible care and support."
