,links,dates,titles,content
27,https://www.seniorsadvocatebc.ca/app/uploads/sites/4/2018/04/Tax-Reminder-NR-2018-Final.pdf,"Apr 17, 2018","B.C. Seniors Advocate reminds seniors to file taxes (pdf, 102 KB)","NEWS RELEASE  For Immediate Release April 17, 2018  B.C. Seniors Advocate reminds seniors to file taxes    Victoria Œ It is tax time again and the B.C. Seniors Advocate is reinforcing the need for seniors in the province to file tax returns, even if they think they do not make enough income to file.   ﬁSeniors may not know that there are several subsidies and tax credits they may be eligible for that are dependent on completed tax returns,ﬂ said Isobel Mackenzie. ﬁThis is particularly important for low-income seniors who may be missing out on subsidies and tax credits that could help them financially,ﬂ Mackenzie added.  ﬁThe good news is, most government programs that are income based are linked to the Canada Revenue Agency who will automatically advise the province of an individual senior™s latest income upon which to base a subsidy, so seniors are not required to re-apply every year,ﬂ Mackenzie said. ﬁThe bad news is, if seniors don™t file income tax, their subsidy for things like PharmaCare and SAFER could be dropped and seniors could be left paying the full cost of their drugs or losing their rent subsidy. In addition fees for residential care and home support are based on income and without verification from the latest tax return, seniors will find themselves paying the full rate.ﬂ   There are approximately 250 free Volunteer Income Tax Clinics operating throughout the province that are able to assist seniors who may require help to file their taxes.   A full list of free income tax services for all communities in B.C. is available at http://www.cra-arc.gc.ca/tx/ndvdls/vlntr/clncs/bc-eng.html or by calling the Office of the Seniors Advocate at 1.877.952.3181.   Also, new this year is the Revenue Canada service called File My Return.  Canadians with a low or fixed income that is unchanged year to year have been invited to file their return over the phone. Information about this service can be found at https://www.canada.ca/en/revenue-agency/campaigns/file-my-return.html.   Financial subsidies available to seniors that rely on tax returns for eligibility include:   Guaranteed Income Supplement (GIS) Œ a monthly benefit for seniors receiving Old Age Security who are on a low income, $24,955 or less   Shelter Aid for Elderly Renters (SAFER) Œ provides a subsidy directly to those aged 60 or older who live in a private market rental unit and are on a moderate to low income    BC Bus Pass Program Œ offers subsidized annual bus passes ($45 annually) to low-income seniors receiving GIS   BC Seniors Supplement Œ a monthly top-up of up to $49.30 to the federal OAS/GIS or federal allowance payments Medical Services Plan (MSP) Premium Assistance Œ offers reduced monthly premiums on a sliding scale to moderate and low-income individuals   Fair PharmaCare Œ subsidizes the cost of prescription drugs   Home Adaptation for Independence (HAFI) grant Œ provides financial assistance to help eligible low-income seniors make renovations necessary to continue to live at home    Publicly funded residential care and assisted living Œ client portions are calculated based on after tax income   All co-payments for home support are waived for seniors in receipt of GIS   Pension income splitting Œ seniors receiving pensions may be eligible to split up to 50% of eligible pension income with a spouse or common-law partner   Goods and Services Tax/Harmonized Sales Tax credit Œ a tax-free quarterly payment that helps offset all or part of the GST or HST paid    Media contact:     Edward Gomboc  Office of the Seniors Advocate 778.698.8143"
28,https://www.seniorsadvocatebc.ca/app/uploads/sites/4/2018/01/QuickFacts2018-NR.pdf,"Jan 31, 2018","B.C. Seniors Advocate released third annual comprehensive directory for residential care facilities (pdf, 126 KB)","NEWS RELEASE  For Immediate Release January 31, 2018  B.C. Seniors Advocate posts comprehensive Directory of B.C.™s  publicly-subsidized residential care facilities   Victoria Œ The Office of the Seniors Advocate posted an updated version of the British Columbia Residential Care Facilities Quick Facts Directory today.  The Directory, first published in 2016, provides key information in a standardized format for 293 publicly funded licensed care facilities in British Columbia, representing 27,142 publicly subsidized beds.  A summary document highlights key trends in residential care based on the past three years of data.   ﬁThe Directory is designed to be a useful resource for seniors, their caregivers and the public when making decisions about what care home may best suit an individual™s needs,ﬂ said Seniors Advocate Isobel Mackenzie.  ﬁWe have also discovered information in the Directory can provide us with a useful tool to look at systemic issues,ﬂ Mackenzie added.  The Directory provides information relating to a number of areas, including bed/room configuration, food services, inspection information, care services, as well as information about the health characteristics of residents in B.C.™s facilities.  The Directory also provides quality of care indicators as reported by the Canadian Institute of Health Information.  These include data about residents™ access to therapies, level of social engagement, use of antipsychotic and antidepressant medications, and use of physical restraints.  This year™s Directory also includes facility-level results from the Office of the Seniors Advocate™s recent survey of people living in residential care and their family members.  ﬁThere is arguably no better measure of gauging the quality of care of a facility than talking to the people who live there,ﬂ said Mackenzie.  ﬁThis year™s Directory provides an opportunity to hear the voices of those who experience, on a daily basis, what it™s like to live in licensed care homes, and that™s very important information to share,ﬂ Mackenzie said, adding that survey questions focused on a range of areas from observations about food and staff responsiveness to social engagement and physician care.   The Advocate also released a summary document highlighting trends based on the data contained in the Directory.  Highlights include:   Only 15% of facilities meet the provincial guideline of 3.36 hours of direct care per resident per day in 2016/17.  This is an improvement over the previous year, when only 9% were meeting the guideline.  Four percent of contracted facilitiesŠcompared to 33% of health authority owned and operated facilitiesŠ were funded to meet or exceed the guideline. Overall, 73% of residents reside in single-occupancy rooms; 87% of rooms in residential care are single-occupancy, 9% are double-occupancy and 4% are multi-bed rooms.  There are some differences between facilities based on ownership type.  Health authority owned and operated facilities, on average, have higher funded direct care hours, higher rates of therapy, fewer single-occupancy rooms, more complex and physically-dependent residents, and fewer reportable incidents and substantiated complaints compared to contracted facilities.  On average, almost half of all residents had a low sense of social engagement, (0-2 on the seven point Index of Social Engagement measurement tool).  In 2016/17, there were 4,629 reportable incidents reported to Licensing Officers in B.C. This is slightly higher than in 2015/16 (4,579).  However, the rate of reportable incidents decreased from 17.5 incidents per 100 beds in 2015/16 to 17.4 incidents per 100 beds in 2016/17. Overall, the rate of reportable incidents was 24% higher in contracted facilities than in health authority owned and operated facilities.  Between 2015/16 and 2016/17, substantiated complaints fell by 13%, from 207 to 181.  In 2016/17, there were 1.6 substantiated complaints per 1,000 beds involving health authority owned and operated facilities, and 8.9 per 1,000 beds in contracted facilities. The ﬁconversion rateﬂ of complaints to substantiated complaints was 54% higher in contracted compared to health authority owned and operated facilities.  Across B.C., 24% of residents were diagnosed with depression and 48% of residents were prescribed antidepressant medication, both of which are very similar to previous years.  In 2016/17, 25% of residents were prescribed antipsychotic medications without a diagnosis of psychosis, which is a 7% decrease from the previous year.  Between October 2016 and September 2017, 8% of residents had daily physical restraintsŠan 11% decrease from the previous year.  Data on the average funded food costs per resident, per day were collected for the first time in 2016/17.  The average funded food cost in B.C. in 2016/17 was $8.00 per resident, per day.  However, there was significant variation among facilities ranging from an overall low of $4.92 to a high of $18.44 per resident per day.  Overall, 24% of facilities contract out food services, and 91% of facilities have food prepared on site.  The British Columbia Residential Care Quick Facts Directory can be viewed online on the Office of the Seniors Advocate™s website under the ﬁKey Guidesﬂ section at www.seniorsadvocatebc.ca.  To view the summary companion document, please click here.   Media contact: Sara Darling Director of Communications  Office of the Seniors Advocate 778-679-2588"
29,https://www.seniorsadvocatebc.ca/app/uploads/sites/4/2017/12/MonitoringReport2017-NR.pdf,"Dec 14, 2017","Seniors Advocate releases third annual Monitoring Seniors Services report (pdf, 149 KB)","For Immediate Release December 14, 2017   Seniors Advocate releases third annual Monitoring Seniors™ Services Report  Victoria Œ The Office of the Seniors Advocate (OSA) released its third annual Monitoring Seniors™ Services report today. The report looks at over 25 programs and services offered to seniors in B.C. and measures performance on a year over year basis.   ﬁThis is now the third year my office has published this report and we are seeing some very meaningful trends that can tell us whether we are heading in the right direction in delivering the supports and services that are key to assisting seniors to maintain independence and enjoy good health,ﬂ said B.C. Seniors Advocate Isobel Mackenzie.   The report shows growth in the seniors™ population is on track with projections as the number of people in the province over the age of 65 grew by 32,307 to a total of 18.4% of the population compared to 17.9% last year.  With a B.C. total of 882,731 people age 65 and over, Vancouver Island Health Authority and Interior Health Authority continue to have the highest rate of seniors at 23% of their population while Northern Health continues to have the youngest population with only 14% of their population age 65 and older.   ﬁThe results for 2017 highlight several areas of concern for me,ﬂ said Mackenzie. ﬁThere is a continued decrease in home support service and adult day programs as well as an increasing lack of affordability for senior renters,ﬂ Mackenzie added.  ﬁThese results should also be of concern to the government as lack of support in these areas will drive some seniors into residential care which is a more costly intervention and one that is least preferred by seniors. We know there are up to 15% of seniors living in residential care who could live in the community with proper supports.ﬂ  With 19% of senior households renting, the affordability gap continues to widen with rents for a one-bedroom apartment increasing 6.7% with no increase to the Shelter Aid for Elderly Renters (SAFER) subsidy cap and basic retirement income rising by only 1.2%.  In addition, the number of seniors™ subsidized housing units continued to decrease and the waiting list increased 15.6%.  ﬁThe economic reality for seniors who rent is the most dire,ﬂ said Mackenzie. ﬁWe know that seniors have the lowest median income of any age cohort over 25 and we know that the poverty rate for seniors increased by 24% since 2005, the largest increase of any age cohort.  The ability of seniors, particularly those aged 80 and greater to move to less expensive neighbourhoods is very limited.  Seniors must be located near transit and services given they will depend on these more and more as they age.ﬂ   The report also looks at trends in transportation services for seniors highlighting that for the first time in four years there has been an increase in HandyDART ride requests. There was a 5% increase in new clients and a 10% increase in the number of rides. ﬁTransportation is very important and can be quite complicated for seniors, as they may have some mobility or vision challenges that no longer allow them to drive but they are still active and engaged in their community,ﬂ said Mackenzie. ﬁHandyDART can mean the difference between being a total shut-in and able to get out 2 or 3 times a week.ﬂ  For the 81% of senior households that own their home, the number of new individuals claiming property tax deferment nearly doubled in the last year.  ﬁThe popularity of the Property Tax Deferment Program demonstrates its value in helping those seniors who are homeowners to address the rising costs of  NEWS RELEASE maintaining a home,ﬂ Mackenzie said.  As in past years, seniors show a high level of attachment to a family doctor and 2017 saw decreasing wait times for residential care after they increased last year. 2017 is the first year the Monitoring Seniors™ Services report has included data from police sources regarding reported crimes of abuse and theft against seniors.  Both the Public Guardian and Trustee and the Seniors Abuse and Information Line (SAIL) reported increases in the number of abuse and neglect cases reported.   ﬁPart of what this report highlights is the significant number of services that are available to assist seniors, ensuring they keep pace with demand and that they are easily accessible is equally important.  Reviewing our performance on an annual basis is an important measure of our success,ﬂ concluded Mackenzie.  See below for highlights of the 2017 Monitoring Seniors™ Services report. The full report can be viewed at www.seniorsadvocatebc.ca    Media contact: Sara Darling Director of Communications Office of the Seniors Advocate 778 679-2588  Monitoring Seniors™ Services 2017 Highlights  Ł     In 2015/16, 92% of seniors were attached to a GP or GP practice; this has remained relatively constant over the past three years.  Ł     While the number of B.C. seniors with dementia has increased since last year, the rate of dementia has remained constant; 94% of seniors 65+ and 80% of seniors 85+ do not have dementia. The number of clients supported by the First Link program has increased 15%. Ł     The average home support hours delivered per client per year decreased by 3% from the previous year, while the number of clients increased by 3.5%. This trend of decreases in home support matched against increased client complexity continues to be of concern. Ł     There has been a 23.5% increase in the number of home care complaints over last year; this includes professional services such as nursing and physical therapy, as well as home support. Ł     On March 31, 2017, there were 1,245 clients waiting to access Adult Day Programs. The median wait time ranged between 38 and 195 days. Since 2015/16, there has been an 8% decrease in the number of funded Adult Day Program days offered and a 4% decrease in clients. Ł     While there has been a 1.5% increase in funded residential care beds since last year, the population aged 75+ increased by 3.5%.  Ł     Across the province, there was a 6% increase in complaints about residential care this year. Ł     The number of subsidized Assisted Living units remains relatively constant, up 2% from 2016. Ł     The number of seniors on the waitlist for both Assisted Living and Residential Care decreased. In 2016/17, 61% of seniors were admitted to residential care within 30 days, compared to 57% in 2015/16. Housing Ł     81% of households maintained by seniors are owned and 19% are rented. Approximately one-quarter of seniors that own their own home still maintain a mortgage.  Ł     Since 2005, the Shelter Aid for Elderly Renters (SAFER) maximum rent that qualifies for a subsidy has increased 9%, while rents have increased by 45% (7% in the last year alone). Ł     A higher rate of seniors aged 60 or older are now using SAFER, growing from 16.6 per 1,000 in 2014 to 18.4 per 1,000 in 2017. As well, there has been a 6% increase in the absolute number of SAFER recipients since 2016, while the target population has increased by only 4%. Ł     The number of Seniors™ Subsidized Housing units continues to decrease. From 2013/14 to 2016/17, there was a decrease of almost 5%. The number of people 55 or older waiting for a unit increased nearly 16% in the last year alone. Ł     The median and average wait times for Seniors Subsidized Housing increased slightly from 1.3 to 1.4 years and 2.2 to 2.3 years, respectively, between 2015/16 and 2016/17. Ł     For older adults (55+) who are homeowners, there was a 94% increase in the number of new Property Tax Deferrals with nearly $162 million of property taxes deferred in total. Transportation Ł     There was a 5% increase in the number of new clients registered for HandyDART from last year, a 10% increase in ride requests, and a 10% increase in rides provided. Ł     There was an 8% increase in unaccommodated standby ride requests for HandyDART in Metro Vancouver. Ł     In 2016, 655,000, or 76%, of all seniors maintained an active driver™s licence, a 4.5% increase since 2015. The population 65+ grew 4% over this same time period.  Ł     In 2016, 65,810 driver fitness cases were opened for those aged 80 or older. Only 950 seniors (fewer than 2%), were subsequently referred for a DriveAble cognitive assessment.  Income Supports Ł     The maximum payment for CPP increased by 2% over last year. Ł     The Seniors Supplement, a monthly top-up provided by the provincial government to  low income seniors remains at $49.30. There has been no rate increase since 1987. Ł     As of January 1, 2018, single seniors with an income of up to $45,000 or senior couples with an income of up to $51,000 may be eligible for some level of MSP Premium Assistance based on allowable deductions. In 2016, 331,682 seniors received some level of Premium Assistance, a 12% increase over the previous year. Elder Abuse Ł     The Public Guardian and Trustee responds to allegations and investigates cases of abuse, neglect, and self-neglect. In 2016/17, there were 1,638 referrals, a 3% increase over last year. Ł     The Seniors Abuse and Information line received 1,763 calls pertaining to abuse in 2016, a 21% increase compared to 2015. Ł     In 2016, 941 missing persons cases involving seniors were opened with the RCMP. In 897 (95%) cases, the senior was found. The RCMP is responsible for policing regions of the province covering 72% of the population. Also in 2016, the Vancouver Police Department handled 423 missing persons cases involving seniors, all of which were solved. Ł     In regions served by the RCMP, the number of 65+ victims of violent offences has decreased since 2009, while the number of 65+ victims of property offenses has increased by 36%. "
30,https://www.seniorsadvocatebc.ca/app/uploads/sites/4/2017/09/Residential-Care-Survey-NR-Sept-15-Final.pdf,"Sep 15, 2017","B.C. Seniors Advocate releases results of landmark residential care survey (pdf, 100 KB)","NEWS RELEASE  For Immediate Release September 15th, 2017  B.C. Seniors Advocate releases results of landmark residential care survey  Vancouver Œ B.C. Seniors Advocate Isobel Mackenzie released provincial results of her office™s survey of publicly subsidized residential care homes today. This is the most extensive survey of residents™ quality of life ever conducted in Canada.  ﬁFor the first time in this province, we have heard the collective voices of some of our most frail and vulnerable seniors across all of our care homes,ﬂ said Mackenzie. ﬁWhat they are telling us is that while some are satisfied in some areas, overall, we need to be doing better, and in some cases, much better in ensuring the needs of residents are met,ﬂ Mackenzie added.  The survey asked a range of questions on residents™ experiences of day to day activities and care from questions about food quality and staff responsiveness to observations of physician care and social connectedness. The survey was conducted between June 2016 and May 2017. Residents™ most frequent visitors, usually a family member, were also mailed surveys.  ﬁWe are very good at using clinical measurements to gauge how we™re doing in this area such as numbers of falls etc.,ﬂ said Mackenzie. ﬁWhat we haven™t been good at is actually asking the residents themselves what they think of the care they receive and this survey gave us the opportunity to hear feedback that is so critical in making care improvements,ﬂ Mackenzie added.   Key positive responses from the survey include:   50% of residents rated the overall quality of the care home as very good or excellent with 83% of residents believing the staff know what they are doing  88% of family members report being involved in decisions about the care of their loved one  80% of residents indicate they get the services they need  65% of family members rated the facility 8 or higher when 10 was the highest possible score  88% feel safe in the care home  86% of residents feel staff treat them with respect   88% of family members or most frequent visitors report that facility staff addresses their concerns always or most of the time  Key areas where residents and families said improvements are needed include:   62% of residents say they do not get to bathe or shower as often as they want   One in four residents say they sometimes, rarely or never get help to the toilet when needed and 25% of residents report staff tries to relieve physical discomfort sometimes, rarely or never    More than one-third of residents report they are not consistently getting the help they need at mealtimes  Almost 46% of residents report there is no one living in the facility that they consider a close friend and 45% report there is no one for them to do things with   Less than half (46%) of residents say staff regularly make time for friendly conversation 49% of residents only sometimes, rarely or never have the same care aide on most weekdays  4 out of 10 residents living in residential care do not want to be there  Only 57% of residents report that the care facility regularly feels like home  ﬁWe have heard from 20,000 British Columbians - 10,000 residents and 10,000 family members - and together their voices send three strong messages–more staff, more freedom and more conversation,ﬂ said Mackenzie. ﬁResidents need more help in some areas reflecting the fact there are not enough staff; many are lonely and want to be talked to and engaged and they want what we all do, more freedom to control all aspects of their day to day lives from when they get up in the morning to what time of day they eat their meals.ﬂ  The Advocate makes eight recommendations in the report for system improvements including increasing care hours and ensuring staffing levels are enforced and monitored by heath authorities, increasing flexibility of how and when care is delivered, increasing training focused on the emotional needs of residents, expanding the role of nurse practitioners in residential care facilities and increasing the range of activities provided in residential care facilities, particularly in the evenings and weekends. The Advocate also recommends ongoing use of this survey tool to ensure progress is monitored.  ﬁWe have to remember that for people who are living in residential care, this is their home, and very likely their last home,ﬂ said Mackenzie. ﬁWe need to do all that we can to ensure those who live there, have the very best experience possible.ﬂ  Background and full highlights of the Office of the Seniors Advocate™s Residential Care Survey are available at www.seniorsadvocatebc.ca   Media contact:  Sara Darling  Director of Communications  Office of the Seniors Advocate  778-679-2588"
