,links,dates,titles,content
43,https://www.seniorsadvocatebc.ca/app/uploads/sites/4/2016/06/property-tax-deferment-NR-Final.pdf,"Jun 01, 2016","Advocate encourages seniors to consider property tax deferment (pdf, 220 KB)","For Immediate Release June 1st, 2016   BC Seniors Advocate encourages seniors to access BC Property Tax Deferment Program  Victoria  As the deadline approaches for BC homeowners to pay property taxes, BC Seniors Advocate Isobel Mackenzie is encouraging seniors to consider property tax deferment as a way to stay living independently. BC individuals, including senior homeowners, to defer paying taxes for a low simple interest charge (currently 0.7%) that accrues until they withdraw from the program voluntarily, upon ownership transfer, or upon death.  ving in their own homes who have a very challenging time getting the money together to pay their taxes, and in some cases this drives thassists seniors in continuing to live independently as long as possible, which research shows increases overall health and significantly decreases overall   Approximately 80% of seniors in BC are homeowners (609,920) and 24% of senior homeowners have an annual income of $30,000 or less. To qualify for the Property Tax Deferment program you must be 55 or older and have a minimum of 25% of equity in your home. Application to the program can be made once tax notices are received.   , deferring may be an uncomfortable idea, and they may be worried about   Mackenzie points out that ins, even after deferring property taxes for ten years. The following examples use 2016 municipal tax rates, and assume a mild (2%) annual appreciation.   A $1,000,000 mortgage-free house in Vancouver would have 96.7% equity remaining after deferring property taxes for 10 years.  A $470,000 mortgage-free house in Kelowna would have 93.7% equity remaining after deferring property taxes for 10 years.  A $250,000 mortgage-free house in Comox would have 92.3% equity remaining after deferring property taxes for 10 years. There were 5,278 new users of the Property Tax Deferment Program in 2015, a 10% increase from 2014, but a 2% drop since 2013, when there were 5,375 new users of the program. In 2015, $131.6 million was deferred under the program.  Additional subsidies available to senior homeowners include the Home Owner Grant, which can reduce homeowners and up to $1,045 if the property is located in a northern and rural area. Seniors who own homes assessed above $1.2 million may be eligible for the low-income grant supplement, which replaces any grant amount they would have received if their home were below the threshold. Single seniors earning up to $35,000 could qualify, and senior couples earning up to $41,000 could qualify.   To learn more about the Home Owner Grant:  http://www2.gov.bc.ca/gov/content/taxes/property-taxes/annual-property-tax/reduce/home-owner-grant  To learn more about the Seniors Low-Income Supplement: http://www2.gov.bc.ca/gov/content/taxes/property-taxes/annual-property-tax/reduce/home-owner-grant/senior/low-income   To find out more about the Property Tax Deferment Program and learn how to apply:  http://www2.gov.bc.ca/gov/content/taxes/property-taxes/annual-property-tax/pay/defer-taxes   Media contact:   Sara Darling      Jamie Edwardson Director of Communications    Director, Communication Office of the Seniors Advocate   Ministry of Finance 778 679-2588     250 356-2821"
44,https://www.seniorsadvocatebc.ca/app/uploads/sites/4/2016/04/Tax-Reminder-NR-revised-April-28th.pdf,"Apr 18, 2016","Advocate reminds seniors in B.C. to file tax returns (pdf, 101 KB)","NEWS RELEASE  For Immediate Release April 18, 2016  B.C. Seniors Advocate underscores need for all seniors to file taxes   Victoria Œ B.C. Seniors Advocate is reinforcing the need for seniors in the province to file tax returns, even if they think they do not make enough income to file.   ﬁThere are many subsidies available to seniors that are based on income tax information,ﬂ said Isobel Mackenzie. ﬁIf seniors don™t file their taxes, low-income seniors in particular may be giving up opportunities to access subsidies which can make significant differences to their lives.ﬂ  The importance of filing taxes was highlighted in a recent case where the Federal Government found that 83,000 Canadian seniors, 13,000 of them in B.C., did not receive Guaranteed Income Supplement (GIS) payments for up to seven years because they did not file income tax for one or more years. The Federal Government is now fixing the problem and making retro-active payments to these low-income seniors. ﬁGIS is a key support for the lowest income seniors,ﬂ said Mackenzie.  ﬁThese are seniors living on $17,300 annually or less, however to receive this GIS, you must file an income tax return.ﬂ   In British Columbia, the median income of those over 65 is $24,000 and $22,000 for those over 75. Roughly one-quarter of senior homeowners have household incomes of less than $30,000. Approximately 35 percent of seniors who rent, have household incomes of less than $20,000. There are 54,000 seniors living on $17,000 or less annually. ﬁClearly there are many seniors in this province who are facing very challenging financial situations,ﬂ said Mackenzie.  ﬁFor these people, any financial support can result in life-changing outcomes, the ability to pay for a hearing aid, or uninsured dental care, or basic living expenses such as covering monthly rent.ﬂ  Mackenzie stresses it is important for seniors to know that there is help available to prepare income tax returns and it is free of charge for low-income seniors. Throughout the province there are Volunteer Income Tax clinics hosted by local community agencies. Volunteers, many of whom are retired accountants, receive training from the Canada Revenue Agency and are aware of all recent changes and relevant tax issues affecting seniors. Each year over 10,000 tax returns are prepared through this program.   Financial subsidies available to seniors that rely on tax returns for eligibility include:   Guaranteed Income Supplement (GIS) Œ a monthly benefit for seniors receiving Old Age Security who are on a low-income, $17,300 or less   Shelter Aid for Elderly Renters (SAFER) Œ provides a subsidy directly to those aged 60 or older who live in a private market rental unit and are on a moderate to low income    BC Bus Pass Program Œ offers subsidized annual bus passes ($45 annually) to low-income seniors receiving GIS BC Seniors Supplement Œ a monthly top-up of $49.30 to the federal OAS/GIS or federal allowance payments   Medical Services Plan (MSP) Premium Assistance Œ offers reduced monthly premiums on a sliding scale to low-income individuals   Fair PharmaCare Œ subsidizes the cost of prescription drugs   Home Adaptation for Independence (HAFI) grant Œ provides financial assistance to help eligible low-income seniors make renovations necessary to continue to live at home    Publicly funded residential care and assisted living Œ client portions are calculated based on after tax income   All co-payments for home support are waived for seniors in receipt of GIS   A full list of free income tax services available in all communities in B.C. is available on the Canada Revenue Agency™s website: http://www.cra-arc.gc.ca/tx/ndvdls/vlntr/clncs/menu-eng.html or by calling the Office of the Seniors Advocate at 1.877.952.3181.   Media contact:     Sara Darling, Director of Communications  Office of the Seniors Advocate 778-679-2588 Sara.Darling@gov.bc.ca www.seniorsadvocatebc.ca"
45,https://www.seniorsadvocatebc.ca/app/uploads/sites/4/2016/03/QUICK-FACTS-News-Release.pdf,"Mar 18, 2016","Seniors Advocate releases first comprehensive directory for residential care facilities (pdf, 292 KB)","For Immediate Release March 18th, 2016   B.C. Seniors Advocate releases first comprehensive directory for residential care facilities  Victoria  The Office of the Seniors Advocate released the British Columbia Residential Care Quick Facts Directory today. The directory provides key information in a standardized and concise format for 292 publicly funded licensed care facilities in British Columbia.     The Residential Quick Facts Directory provides information in a number of areas including:   Address, age of facility, regulation/legislation, accreditation status, bed/room information  Food services, nursing, allied health (physio, occupational, recreation, speech and language therapies, social work services) and total funded direct care hours per resident per day  Current languages spoken, contact for complaints, type of resident or family council  Date of last inspection/reason for inspection  Number of serious adverse events reported if Hospital Act facility, quantity and type of reportable incidents if Community Care and Assisted Living Act facility   Care Services and Quality Indicators as reported by the Canadian Institute for Health Information by facility and compared to the B.C. average such as percentage of residents diagnosed with depression vs. percentage of residents receiving depression medication, and percentage of residents who have taken antipsychotic medications  The British Columbia Residential Care Quick Facts Directory can be viewed online on the Office of the Seniors Advocate website under Reports & Publications at www.seniorsadvocatebc.ca.    Media contact:  Sara Darling  Director of Communications   Office of the Seniors Advocate  778-679-2588  sara.darling@gov.bc.ca"
46,https://www.seniorsadvocatebc.ca/app/uploads/sites/4/2016/01/MONITORING-REPORT-NR.pdf,"Jan 27, 2016","B.C. Seniors Advocate releases first comprehensive report Monitoring Seniors Services and announces systemic review of resident on resident aggression in licensed care (pdf, 143 KB)","NEWS RELEASE  For Immediate Release January 27th, 2016   B.C. Seniors Advocate Releases first comprehensive report Monitoring Seniors™ Services and announces systemic review of resident on resident aggression in licensed care  Victoria Œ The Office of the Seniors Advocate (OSA) released its first Monitoring Seniors™ Services report today. The report marks the beginning of what will become a yearly update from the OSA on the status of key seniors™ services in the province, highlighting where seniors™ needs are being met, and where improvements are most needed.   ﬁOur goal with this process is to provide the public and policy makers with a single source of data where they can compare year over year how we are doing in this province in delivering services that are critical to seniors,ﬂ said Seniors Advocate Isobel Mackenzie. ﬁWhen we examined the data across all areas, we found a number of interesting stories that are starting to emerge, some are positive, some are cautionary, and some indicate the need for immediate improvements.ﬂ   Among areas that affect seniors positively, the report notes that 96% of seniors report they have a regular GP. Data also highlights that four out of five seniors over the age of 85 have no diagnosis of dementia. ﬁWhile the risk of dementia clearly increases with age it is very important to get the message out to seniors that they have greater likelihood of living a full life without developing dementia,ﬂ stated Mackenzie.  The report also outlines a number of areas of concern, most notably the number of incidents of resident on resident aggression in residential care facilities. Data presented in the report confirm there were between 425 and 550 incidents of resident on resident aggression that resulted in harm in residential care reported in 2014/15. Based on these findings, the Advocate will conduct a systemic review of resident on resident aggression this year.   ﬁWhile we have to remember this is still a small number when you consider there are more than 27,000 individuals in residential care at any given time in this province, the numbers are still substantial enough to warrant our office taking a closer look at this issue,ﬂ said Mackenzie.  ﬁWe are beginning in-depth research to see if there are particular patterns or systemic issues that contribute to an increased likelihood of resident on resident aggression,ﬂ continued Mackenzie.    The 60-page Monitoring Seniors™ Services report focuses on 2014/15 data highlighting key services in the Advocate™s legislated seniors™ services which include transportation, health care, housing, income support and personal care.  Further highlights from the report include:   Home support hours decreased in three out of five health authorities, while the number of clients increased in four out of five  There are 943 individuals on the waitlist for a total of 4,430 subsidized assisted living units. There has been less than a 1% increase in the number of subsidized assisted living units since 2012 The number of residential care beds in the province has increased by 3.5% since 2012, but the population over 75 has increased 10% during that time and the number of seniors placed within the 30-day target window has decreased from 67% to 63% in the past year  18% of licensed residential care facilities did not have an annual inspection within the last year  Since 2005, the Shelter Aid for Elder Renters (SAFER) maximum rent that qualifies for a subsidy increased 9% while rents increased by 34%  The number of new HandyDART users is decreasing Œ down 15% since 2011. 51, 926 (1.9%) of regular HandyDART ride requests went unfulfilled in 2014  Income supports for seniors such as the Old Age Supplement and Guaranteed Income Supplement increased by 1%. The BC Seniors™ Supplement, available to low-income seniors, has not increased in over 25 years   The number of people aged 65 plus accessing the BC Bus Pass Program (offers subsidized passes to low-income seniors and individuals receiving disability assistance from the province) has increased by 21% since 2010  In 2014, 33%, or 48,840 of all drivers evaluated under the Driver Medical Examination Report (DMER), an evaluation for fitness to drive, were aged 80 or over. Only 1% of people of all ages or less than 3% of seniors evaluated through a DMER were referred to DriveAble for cognitive assessment   The Seniors Abuse and Information Line (SAIL) received 1,286 calls related to elder abuse in 2014 and 15% of these calls reported the abuse had been going on for five or more years   The Seniors Advocate will use data contained in this report for upcoming reviews in 2016. In addition to a systemic review of resident on resident aggression, the Office of the Seniors Advocate will be conducting reviews of home support, supplemental benefits for seniors, transportation, residential care and hospital discharge experiences in 2016. Additional services monitored by the Advocate will be added as data becomes available.  The Office of the Seniors Advocate is an independent office of the provincial government with a mandate of monitoring seniors™ services, issuing public reports focusing on systemic issues and providing information and referral to seniors and their families.  -30-  Media contact:     Sara Darling Director of Communications  Office of the Seniors Advocate 778-679-2588 sara.darling@gov.bc.ca"
47,https://www.seniorsadvocatebc.ca/app/uploads/sites/4/2016/01/OSA-MSP-Premiums-statement1.pdf,"Jan 04, 2016","Advocate statement on MSP premium increases (pdf, 123 KB)","Statement   For Immediate Release January 4th, 2016  A Reminder: Subsidy to Pay MSP Premiums Available for Low-Income Seniors  Victoria Œ With the January 1st increase to MSP Premiums, British Columbia's Seniors Advocate, Isobel Mackenzie, is urging seniors to check if they are eligible for full or partial payment of their monthly MSP Premium.  ""Some seniors are paying $900 per year for their MSP and many may qualify for a full or partial subsidy of this amount,ﬂ stated Mackenzie. ﬁSeniors have one of the lowest median incomes and would likely benefit the most from MSP Premium Assistance, however many are not aware that they qualify,ﬂ continued Mackenzie who highlighted the lack of awareness in her 2015 report Bridging the Gaps. In this report, which randomly surveyed seniors across B.C., it was found that overall awareness of MSP premium assistance was low among survey respondents, with only 39 per cent being aware of the program. Paradoxically, awareness was lowest amongst those who would most likely qualify Œ seniors with household incomes under $30,000. ""We must do all that we can to ensure that seniors are aware of, and accessing the assistance they are eligible for,ﬂ said Mackenzie.  The Regular Premium Assistance program has five levels of subsidies on a sliding scale for individuals and families earning less than $30,000, with those earning under $22,000 paying no premium at all. A one-time application must be filled out. Subsequent years are calculated automatically based on the information in the recipients' income tax returns. Regular Premium Assistance may also be provided retroactively up to six years from the date of application. As of January 1, 2016, the premiums for those with a net income over $30,000 will be increasing by approximately four per cent over 2015 costs, while premiums for those with incomes less than $30,000 will stay unchanged at current levels.  To learn more about, and apply for, Regular and Temporary Premium Assistance, visit http://www2.gov.bc.ca/gov/content/health/health-drug-coverage/msp/bc-residents/premiums or call 1-800-663-7100.  The Office of the Seniors Advocate is an independent office of the provincial government with a mandate of reporting on systemic issues, monitoring seniors' services and raising awareness of issues affecting seniors in British Columbia. The OSA provides information and referrals through its toll-free line Œ 1-877-952-3181  Media contact: Sara Darling Director of Communications Office of the Seniors Advocate 778-679-2588 Sara.darling@gov.bc.ca"
48,https://www.seniorsadvocatebc.ca/app/uploads/sites/4/2015/12/Victoria-Transit-Fare-Review-NR.pdf,"Dec 08, 2015","Seniors Advocate states Victoria Transit Commission decision not to increase seniors' pass a good first step (pdf, 103 KB)","NEWS RELEASE  For Immediate Release December 8, 2015  B.C. Seniors Advocate States Transit Commission Decision Not to Increase Seniors™ Pass a Good First Step  Victoria Œ Seniors Advocate Isobel Mackenzie applauded the decision of the Victoria Transit Commission not to increase the cost of a monthly seniors pass, but is still concerned about the overall cost of transit for low-income seniors.   ﬁGiven the timing and the information in front of them, I think the commission made the best decision that they could to support seniors,ﬂ stated Mackenzie who presented her concerns to the Commission at their public meeting in Victoria Monday.   Options being considered were increases of monthly seniors™ passes from the existing $540 a year to either $624 or $780 a year in respective fare review options.   Mackenzie is advocating a graduated fare that would align with ability to pay.  Currently seniors with an income of $17,280 or less and in receipt of the Guaranteed Income Supplement (GIS), are eligible for the BC Bus Pass, which costs $45 annually.    ﬁMy concern is that if your income is just one dollar over the threshold, a senior immediately must pay the cost of the existing monthly bus pass, which at current prices, translates to $540 yearly, and that is quite a gap.ﬂ   A more progressive approach, says the Advocate, would see the amount a senior pays slowly increase from the $45 amount, as their income increases.  There is a current sliding scale formula in place for low-income seniors who access MSP Premium Assistance. The ceiling is $30,000 for all seniors in B.C.     ﬁTransit could develop a parallel program for purposes of establishing an annual pass for seniors that would allow seniors in receipt of premium assistance to qualify.  There would be no need for BC Transit to verify income, that is done when the senior qualifies for premium assistance.  The administrative burden would be very low and it would ensure that the greatest subsidy goes to those seniors in greatest need, which is a progressive approach to providing subsidies.ﬂ   Attached is a copy of Mackenzie™s presentation to the Victoria Transit Commission.   Media contact: Sara Darling Director of Communications  Office of the Seniors Advocate 778-679-2588 sara.darling@gov.bc.ca -30-"
49,https://www.seniorsadvocatebc.ca/app/uploads/sites/4/2015/09/National-Seniors-Day-op-ed.pdf,"Oct 01, 2015","Celebrating National Seniors Day 2015 (pdf, 243 KB)","Today is the International Day of the Older Person and National Seniors Day, a day set aside in the year to acknowledge the contributions of seniors worldwide. As B.C.™s Seniors Advocate, I am encouraging a celebration of our senior citizens in this province. It may be your dad, your mom, your grandparent, or maybe it™s you we are celebrating.  At the Office of the Seniors Advocate, we focus on systemic issues that affect a large number of seniors. We tackle housing and health care, gaps in home support, income support and transportation. So much of our work looks at what™s wrong when it comes to seniors, but today I want to focus on what™s right. And what is right are the truly astounding qualities I see in seniors as I travel to every corner of the province meeting with seniors face to face.  Today I urge you to celebrate the courage of seniors. The 80-year-old woman with severe arthritis who braves driving rain, but still walks several kilometres to and from the grocery story to get supplies for dinner. The father who decides to become a university student for the first time at 70. The widowed grandparent who steps up to parent a grandchild after raising five kids of her own.  Today is a day to celebrate the selflessness of seniors. In virtually every sector of society it™s easy to see this in action. Individual seniors want to help in the diverse communities they live in. According to StatsCan, Canadians 65 and over, volunteer on average 220 hours per year, higher than any age group. They do it not for their resumes or for graduation requirements, they do it for the most part, because they get a deep satisfaction from helping others. One look at the composition of our service groups tells us this kind of giving is being lost as time goes on.  What I am also reflecting on today is the profound commitment and tenacity I see in many of the seniors I meet. I think of the wife who traveled hours each day by bus to be with her husband at mealtimes. I remember the letter I received from an 83-year-old man who is caring for his wife with severe dementia, declining home support saying he just wants to be the one to put her to bed each night. The seniors I hear from know what they want and many of them are willing to fight, and fight hard to get what they feel they and their loved ones deserve.  I™d like us to also acknowledge another extraordinary quality that so many of our older citizens possess - an unbelievable ability to adapt to change, not just small shifts in the way things are done, but dramatic societal change on a global scale. The variety and magnitude of change that our older population has experienced is almost unfathomable Œ from streetcars to high-speed trains, brooms to vacuum robots, inkwells to iPads, courtship to online dating, and the list goes on.  The individual contributions of our seniors could fill this newspaper for decades to come. It™s these unique experiences of the older people in your life I invite you to celebrate today. Seniors are not all the same. Their likes and dislikes, choices and needs are as different at 80, as they were at 18. Today we aren™t celebrating ﬁseniorsﬂ we are celebrating Edna, Bev, Mohinder, Walter and the other 816,000 amazing individuals who happen to be over 65 living in this province. On this day, we say a heartfelt thank you to everything you offer all of us."
