,links,dates,titles,content
0,https://www.seniorsadvocatebc.ca/app/uploads/sites/4/2022/01/January-6-OSA-NR-LTC-essential-visitors.pdf,"Jan 06, 2022","Statement from Seniors Advocate Isobel Mackenzie on Essential Visitors in Long-Term Care (pdf, 178 KB)","FOR IMMEDIATE RELEASE        NEWS RELEASE January 6, 2022   Every Resident in Long-  Victoria, B.C. B.C. Seniors Advocate, Isobel Mackenzie is asking the Province to declare that every resident in long term care is entitled to designate at least one person as their essential visitor.  While we can all understand the need to limit the number of visitors to long-term care during this latest wave of COVID-19, returning to essential visitors without declaring that every resident is entitled to at least one essential visitor has effectively left the majority of long-term care residents without visits from loved ones, said Mackenzie.  In November 2020, the Office of the Seniors Advocate (OSA) issued the report Staying Apart to Stay Safe: The Impact of Visit Restrictions on Long-Term Care and Assisted Living Survey, which highlighted the impact of visitor restrictions on residents and their family members. In this report, OSA identified that 52% of requests made by residents to designate an essential visitor were denied. The Seniors Advocate issued the recommendation in this report that all residents be provided the opportunity to designate an essential visitor.   To date, no changes have been made to the process for determining if a resident meets the criteria to be designated an essential visitor. The determination is made by the administrator of the care facility on a case-by-case basis. Essentials visits can include, but are not limited to:  Visits for compassionate care, including critical illness, palliative care, hospice care, end of life, and Medical Assistance in Dying  -being, including assistance with feeding, mobility, and personal care  Communication assistance for persons with hearing, visual, speech, cognitive, intellectual or memory impairments  Assistance by designated representatives for persons with disabilities  Visits for supported decision making   receiving phone calls and emails from family members, including spouses, who were advised they could no longer visit their loved one, even though they offer vital support and care. They help to feed their loved one, get them dressed, take them for walks, and keep them engaged. For many residents, these visitors are the only people who can motivate them to engage in any activities, and yet they are not formally recognized as essential,  Current public health orders allow essential visitors to continue to visit if an outbreak is declared at a facility while social visit suspended for the duration of the outbreak. Prior to visiting, all visitors to long-term care facility must be fully vaccinated and rapid antigen tests are administered. are home operators are significantly over-burdened. They need the clarity from the province that every resident is entitled to an essential visitor and be relieved of the staff resources required to manage the essential visitor designation process. As B.C. faces its most prolific wave of this pandemic, care homes need to plan for staff absences of up to 30%, and we know that the care provided to residents by essential visitors can help manage an overburdened care home. I urge the province to empower residents in long-term care to choose a designated essential visitor, as it is only the resident and their families who truly know who is essential to their health and well-being,concluded Mackenzie   Media Contact: OSA Communications P: 250-213-2024  E: osa.comms@gov.bc.ca"
1,https://www.seniorsadvocatebc.ca/app/uploads/sites/4/2021/12/2021-DEC-24-Statement-Cold-Weather.pdf,"Dec 24, 2021","Statement from Seniors Advocate Isobel Mackenzie on Cold Weather Safety (pdf, 116 KB)","Office of the Seniors Advocate Province of British Columbia  1-877-952-3181 www.seniorsadvocatebc.ca  6th Floor, 1405 Douglas Street PO Box 9651 STN PROV GOVT Victoria BC  V8W 9P4  December 24, 2021 Message from the Seniors Advocate  Seniors Advocate Isobel Mackenzie is reminding seniors to stay warm and stay safe as British Columbia faces low temperatures, snow, and freezing rain.  Please stay warm by remaining indoors with proper heating, warm clothing and/or blankets. If venturing outside, take great care while walking as sidewalks may be icy, and wear warm clothes to protect yourself from the cold weather. Please check road conditions before driving and drive with caution and reduce speed to stay safe.  During the cold weather, please check on your elderly family members, friends, and neighbours, especially those living alone. Ensure they have access to food, medication, warm clothes, and other essentials so that they may avoid walking on icy sidewalks or driving on treacherous roads.  And if you are a senior or you know a senior who needs some help with getting groceries, meals or medications, call 211 to connect with local services and supports. Together, we can make sure that seniors stay safe during these harsh winter conditions and have an enjoyable holiday season.  Contact:  Office of the Seniors Advocate info@seniorsadvocatebc.ca 1-877-952-3181  Media contact: Gabrielle Parent gabrielle.parent@gov.bc.ca 250-213-2024"
2,https://www.seniorsadvocatebc.ca/app/uploads/sites/4/2021/12/2021-DEC-22-Statement-Seniors-Advocate.pdf,"Dec 22, 2021","Statement from Seniors Advocate Isobel Mackenzie on Rapid Antigen Tests (pdf, 151 KB)","STATEMENT  FOR IMMEDIATE RELEASE December 22, 2021   Statement from B.C. Seniors Advocate Isobel Mackenzie  British Columbia is currently experiencing a fifth wave of the COVID-19 pandemic fueled by the highly transmissible Omicron variant. In response, public health officials have undertaken several new measures to blunt the potential of this wave to overtake our health care system. These public health restrictions limit the opportunities for transmission and large outbreaks, accelerate the vaccine booster schedule, and expand the provincial testing strategy to include further use of rapid antigen tests to compliment the use of PCR testing. Together, these measures along with the use of masks and the BC Vaccine Card, will hopefully reduce the severity of the fifth wave. I ask every British Columbian to continue to follow the public heath guidelines to protect our vulnerable seniors. While COVID-19 can cause severe illness and death at any age, those aged seventy and older in B.C. have been disproportionately impacted. Since the pandemic began, those aged seventy and older who contracted COVID-19 were 22 times more likely to die than people who were younger, and those aged eighty and older were 44 times more likely to die.   Frail seniors living in long-term care suffered significantly in the first two waves of the pandemic from the virus and visit restrictions. In response, measures to protect our seniors in long term care have been put in place, including mandatory vaccination for staff and visitors, and booster shots for residents and staff. The province has also expanded its rapid testing program for long-term care staff and visitors, providing an additional layer of protection for seniors and their loved ones.  In order to protect the seniors in our communities, as the majority of seniors aged seventy and older still live in their own home, we must limit our exposure to others and keep our circles small during this current wave. In order to allow seniors in the community to safely have contact with loved ones, rapid antigen tests should be available for at-home use to protect this vulnerable population.   Today, I am asking the provincial government to make rapid antigen tests (RAT) available in the community, so that individuals may test themselves prior to visiting their loved ones who are elderly and at highest risk of severe illness. Additionally, I am also asking any members of the public who have secured their own supply of RATs to use them wisely and prioritize usage of the tests for visits with elderly or clinically extremely vulnerable loved ones.  I am also asking that the government, in conjunction with its accelerated booster shot schedule, reduce the current third dose/booster. This change reflects the current reality of British Columbia as we face a pandemic with the highly transmissible Omicron variant.  In the meantime, I strongly encourage everyone to book their third dose/booster shot as soon as possible. Now more than ever, this third shot is critical in our management of the pandemic. And for those who have not yet been vaccinated, I implore you to do so immediately. Vaccines not only protect you, but also those around you and our communities at large.  The past two years have been difficult for everyone, but British Columbians have shown they will do the right thing to protect themselves, their loved ones, and their community. Every day I hear stories of people helping seniors, such as getting groceries or medications and checking in by having a friendly chat. To all those who have lent a hand over this pandemic, I say a profound thank you.  As we near the end of another challenging year, I join so many others in offering my heartfelt thanks to our health care workers. Every front-line worker has my sincere gratitude.  While this is not the holiday season we were all hoping for, if we follow public health guidelines, we can find a way to safely spend time with some of our loved ones. My best wishes for the holiday season to everyone.   Isobel Mackenzie Seniors Advocate Province of British Columbia   Contact: osa.comms@gov.bc.ca 236-478-2026"
3,https://www.seniorsadvocatebc.ca/app/uploads/sites/4/2021/12/LTCD2021-NR.pdf,"Dec 15, 2021","B.C. Seniors Advocate Releases Updated Long-Term Care Directory (pdf, 160 KB)","NEWS RELEASE  FOR IMMEDIATE RELEASE December 15, 2021   B.C. Seniors Advocate Releases Updated Long-Term Care Directory   VICTORIA Seniors Advocate Isobel Mackenzie has released the 2021 update of the Long-Term Care Directory (formerly known as the Long-Term Care Facilities Quick Facts Directory). The Directory provides information on all publicly funded long-term care homes in British Columbia.  As we compare year over year performance, we see continued improvement in direct care hours. However, we also see a troubling trend developing in the use of antipsychotic medications,Mackenzie. The proportion of residents using antipsychotics without a diagnosis of psychosis increased by 8% over the previous year.  decrease in facilities that received one or more inspections in the previous year (73% compared to 83%). However, this is expected to be a COVID-19 specific occurrence as we are   Overall, the directory highlights:  90% of the rooms in long term care are single occupancy, 7% are double occupancy and 4% are multi-bed (3 or more beds) and 77% of residents live in a single room.   32% of residents are totally dependent on staff for their activities of daily living such as toileting, bathing and getting in and out of bed.   50% of residents were assessed as .   The average length of stay in long term care was 2.5 years (900 days), a 7% increase over the previous year, while the median length of stay at 555 days increased by 14%.   On average, care facilities were funded to deliver 3.37 hours of direct care per resident per day and the number of facilities meeting the 3.36 guideline increased from 50% to 83%.   The average food cost increased by 6% (range $5.79-$18.75 per resident/day, average $8.87), while the per diem rate paid to facilities increased by 5% on average (range $206.60-$309.89 per resident/day, average $242.90).   An overall five-year trend of decreased rates of physical, occupational, and recreational therapy continued.   The rate of falls at 13% of residents and pressure ulcers at 2% of residents remained relatively unchanged year over year. Compared to 2019/20, the rate of substantiated complaints per 1,000 beds decreased 25% and the reportable incidents per 100 beds (49.0) decreased by 26% from the previous year. These reductions may be related in large part to the decrease in inspections and the focus on COVID-19 pandemic measures.    The release of the Directory also corresponds with the launch of the new website for the Office of the Seniors Advocate. The new website includes the updated Long-Term Care Directory, featuring an interactive map of all publicly funded long-term care facilities in British Columbia. The interactive map and updated directory include information such as the address, phone number, health authority, room configuration, total number of beds, and quality indicators. This updated directory and webpage will allow seniors, their family members, their caregivers, and key stakeholders to efficiently navigate the long-term care facilities in British Columbia.  -Term Care Directory, seniors and their loved ones will be able to access vital information to help them make informed decisions; and advocates and stakeholders will be able to monitor developing trends and areas of improvement in long-Mackenzie.  The complete Long-Term Care Facilities Directory is available at https://www.seniorsadvocatebc.ca/long-term-care-directory/.  Media contact: Gabrielle Parent osa.comms@gov.bc.ca 236-478-2026"
4,https://www.seniorsadvocatebc.ca/app/uploads/sites/4/2021/12/Hidden-and-Invisible-NR.pdf,"Dec 08, 2021","B.C. Seniors Advocate Calls for Increased Awareness and Better Co-ordination to Combat the Rising Prevalence of Seniors Abuse and Neglect (pdf, 176 KB)","NEWS RELEASE  FOR IMMEDIATE RELEASE December 8, 2021   B.C. Seniors Advocate Calls for Increased Awareness and Better Co-ordination to Combat the Rising Prevalence of Seniors Abuse and Neglect    VICTORIA  Today, Seniors Advocate Isobel Mackenzie released the results of a systemic review of  in a report titled Hidden and Invisible. The report examined current legislative protections, assessed reporting practices, reviewed five years of existing data, consulted with 144 stakeholders in 25 communities throughout B.C., and surveyed over 1500 British Columbians.   The review highlights that reports of abuse and neglect of people 65 and over have increased significantly in the past five years with:  49% increase in report of abuse, neglect and self-neglect to health authorities (Designated Agencies)  69% increase in reports of victims of violent crime to the RCMP  87% increase in reports of physical abuse to the Vancouver Police  49% increase of financial abuse to the Vancouver Police  30% increase in reports of abuse to bc211  tells us that the problem is growing. As the population continues to age, we must ensure our systems for identifying, reporting and reducing seniors abuse and neglect are strong,  The report indicates that 28% of British Columbians report witnessing seniors abuse and neglect, but less than half reported the abuse, mostly because they did not know who to call.   lacking the information and tools they need to ensure quick and effective reporting of the abuse, neglect and self-neglect of our vulnerable seniors,  The report highlights a fragmented system, with many options for a person to report a concern of -neglect. The fragmented system includes seven Designated Agencies with legislated responsibility to respond to protection concerns for vulnerable adults, the police, the Public Guardian and Trustee, the Seniors Abuse and Information Line, and BC211.   tem, we find there are ten or more numbers, that are not well known, that people might call to report an abuse concern. We need to move to a coordinated system similar to what we have for reporting child protection concerns. A system with one phone number that is well known province wide, that people can call if they are concerned a senior is being neglected, abused or is suffering from self-neglectstated Mackenzie. The report also highlighted the need for a centralized tracking and reporting system to better understand patterns and trends over time that will help identify successful intervention strategies.   lect in B.C., and to achieve this we need better data. We cannot effectively fix a problem until it is properly analyzed,commented Mackenzie.   neglect and self-neglect, the report recommends a comprehensive review of the Adult Guardianship Act. There was significant work done in the 1990s to protect vulnerable adults, but we know much more now than we did then. And it is time to apply our learning to update the Act to meet the needs of our cluded Mackenzie.  The report includes five recommendations:  1. Establish provincial standards of practice, policies, and front-line training abuse and neglect 2. Create province-wide public awareness initiatives and training  3. Develop a  4. Ensure consistent data collection, methods, and definitions to record, track and monitor abuse and neglect cases 5. Undertake a full comprehensive review of the Adult Guardianship Act  The complete report is available at https://www.seniorsadvocatebc.ca/osa-reports/hidden-and-invisible-report/.    Media contact: Gabrielle Parent osa.comms@gov.bc.ca 236-478-2026"
5,https://www.seniorsadvocatebc.ca/app/uploads/sites/4/2021/11/booster-doses-for-seniors-NR.pdf,"Nov 22, 2021","Seniors Advocate calls on B.C. seniors to get their booster or third dose as soon as  they are eligible (pdf, 158 KB)","FOR IMMEDIATE RELEASE        NEWS RELEASE November 22, 2021  Seniors Advocate calls on B.C. seniors to get their booster or third dose as soon as they are eligible  Victoria, B.C. B.C. Seniors Advocate, Isobel Mackenzie, is reminding seniors aged 70 or older of the need for a booster, or third dose, of the COVID-19 vaccine.   -19 pandemic is affecting all British Columbians, and our seniors and older adults are among the most vulnerable. The waning protection of the vaccine is based on age, overall health, and the ability to mount an antibody response.  Currently, this places adults aged 70 or older in the community and those in long-term care and assisted living at greater risk. The benefit from a booster or third dose will be most significant for those at greatest risk. Those 70 or older who are registered on the Get Vaccinated provincial registration system will receive an invite to book a booster dose approximately 6 months after their second dose For seniors to receive their booking invitation for the booster or third dose, they must be registered with the Get Vaccinated provincial registration system and their immunization record must be up to date. To register, visit the Get Vaccinated website at gov.bc.ca/getvaccinated. Having the BC Vaccine Card/passport does not mean you are registered with the Get Vaccinated System. The Get Vaccinated phone centre is open seven days a week, 7 am to 7 pm. To ask questions and verify your registration please call 1-833-838-2323.   -term care and assisted living have been offered their third dose and we are now focused on those aged 70 or older who live in the community. registered with the Get Vaccinated system, confirm your information as soon as possibleMackenzie.   If a senior is homebound and unable to get to a vaccine centre, they can receive the vaccine through a home visit from their local health authority.  If a person received their first two doses of the vaccine at home, their health authority will contact them directly to arrange their third shot within the next two weeks if they have not already done so.  If a person needs to be added to the list for a home-based COVID-19 vaccination, they should contact their local health authority.    against the COVID-19 virus. I urge all those who are eligible to book an appointment for their booster or   Media Contact: Gabrielle Parent P: 236-213-2024  E: gabrielle.parent@gov.bc.ca"
